{
  "$schema": "https://json-schema.org/draft/2020-12/schema",
  "$id": "https://raw.githubusercontent.com/kyhuber/run-with-kai/main/schema/health-export.schema.json",
  "title": "Run with Kai \u2014 HealthKit export",
  "description": "One file per pull, written by the Claude iOS app into the Google Drive folder 'run-health-exports'. Append-only: never edit a previous export. Omit any field that was not actually measured \u2014 never estimate or back-fill.",
  "type": "object",
  "required": [
    "pulledAt",
    "window",
    "workouts"
  ],
  "additionalProperties": false,
  "properties": {
    "schemaVersion": {
      "type": "integer",
      "const": 1,
      "description": "Bump only on a breaking shape change."
    },
    "pulledAt": {
      "type": "string",
      "format": "date-time",
      "description": "When this pull ran, ISO 8601 with offset, e.g. 2026-08-22T07:30:00-07:00."
    },
    "window": {
      "type": "object",
      "description": "Inclusive date range this pull covers. Lets the consumer tell 'no runs in this window' apart from 'window not queried'.",
      "required": [
        "from",
        "to"
      ],
      "additionalProperties": false,
      "properties": {
        "from": {
          "type": "string",
          "format": "date"
        },
        "to": {
          "type": "string",
          "format": "date"
        }
      }
    },
    "notes": {
      "type": "string",
      "description": "Free text from the pulling session \u2014 e.g. which data types were unavailable, or that the health integration needs reconnecting."
    },
    "workouts": {
      "type": "array",
      "description": "Every workout in the window, running and non-running alike. The consumer routes Running to SEEDED_ACTUALS and everything else to CROSS_TRAINING.",
      "items": {
        "$ref": "#/$defs/workout"
      }
    },
    "missing": {
      "type": "array",
      "items": {
        "type": "string"
      },
      "description": "What this pull could NOT capture, stated plainly \u2014 unavailable data types, a workout that had not happened yet, splits not queried. Load-bearing: it lets the consumer tell 'no data' apart from 'not pulled', and it is the honest alternative to filling gaps with estimates."
    },
    "restingHr": {
      "type": "array",
      "description": "Optional daily resting HR across the window. Cheap to pull alongside workouts and the clearest recovery signal available, so include it when HealthKit returns it.",
      "items": {
        "type": "object",
        "required": [
          "date",
          "bpm"
        ],
        "additionalProperties": false,
        "properties": {
          "date": {
            "type": "string",
            "format": "date"
          },
          "bpm": {
            "type": "integer",
            "minimum": 25,
            "maximum": 150
          }
        }
      }
    },
    "supersedes": {
      "type": "string",
      "description": "Filename of an earlier export this one replaces in full for the workouts it contains \u2014 e.g. a pull that returns real per-mile splits where the earlier one only had an approximation. Exports stay append-only: never edit the superseded file, and the consumer prefers the later one."
    },
    "corrects": {
      "type": "string",
      "description": "Filename of an earlier export whose interpretation was wrong, where the measurements still stand. Use this for an annotation carrying context only Kai has \u2014 'held back to stay with a partner' \u2014 that changes what the numbers mean without changing the numbers."
    }
  },
  "$defs": {
    "workout": {
      "type": "object",
      "required": [
        "date",
        "kind",
        "mins"
      ],
      "additionalProperties": false,
      "properties": {
        "date": {
          "type": "string",
          "format": "date",
          "description": "Local Seattle date, YYYY-MM-DD."
        },
        "kind": {
          "type": "string",
          "description": "HealthKit workout type: Running, Cycling, Ruck, Walking, Hiking, Strength, ...",
          "examples": [
            "Running",
            "Cycling",
            "Ruck"
          ]
        },
        "dist": {
          "type": "number",
          "exclusiveMinimum": 0,
          "description": "Distance in miles. Required for Running. HealthKit omits it for some workouts (short cycling, strength) \u2014 omit rather than estimating; the consumer drops distance-less entries because the dashboard requires a distance to render."
        },
        "mins": {
          "type": "number",
          "exclusiveMinimum": 0,
          "description": "Elapsed duration in decimal minutes, e.g. 47.40 \u2014 matches the existing data.js convention."
        },
        "hrAvg": {
          "type": "integer",
          "minimum": 30,
          "maximum": 240,
          "description": "Average heart rate, bpm. Omit if unavailable."
        },
        "hrMax": {
          "type": "integer",
          "minimum": 30,
          "maximum": 240,
          "description": "Peak heart rate, bpm. Needs sample-level data \u2014 see the timezone gotcha in SKILL.md."
        },
        "elevGainFt": {
          "type": "number",
          "minimum": 0,
          "description": "Cumulative elevation gain in feet."
        },
        "cadenceAvg": {
          "type": "integer",
          "minimum": 0,
          "maximum": 260,
          "description": "Average cadence in steps per minute (both feet)."
        },
        "calories": {
          "type": "integer",
          "minimum": 0,
          "description": "Active energy burned, kcal."
        },
        "source": {
          "type": "string",
          "description": "Recording device, e.g. 'Apple Watch Series 9'. Useful when accuracy varies by source.",
          "examples": [
            "Apple Watch",
            "iPhone"
          ]
        },
        "note": {
          "type": "string",
          "description": "Anything notable \u2014 terrain, weather, pack weight, 'replaced Sat tempo'."
        },
        "splits": {
          "type": "array",
          "description": "Per-mile splits, in order. Powers decoupling and pacing-discipline analysis. Omit the whole array rather than inventing entries \u2014 a partial final mile is fine as a fractional 'mi'.",
          "items": {
            "type": "object",
            "required": [
              "mi",
              "mins"
            ],
            "additionalProperties": false,
            "properties": {
              "mi": {
                "type": "number",
                "exclusiveMinimum": 0,
                "description": "Mile marker, 1-indexed. A trailing partial mile uses its fractional distance, e.g. 6.21."
              },
              "mins": {
                "type": "number",
                "exclusiveMinimum": 0,
                "description": "Decimal minutes for this split."
              },
              "hrAvg": {
                "type": "integer",
                "minimum": 30,
                "maximum": 240,
                "description": "Average bpm across this split \u2014 the key input for cardiac drift."
              },
              "elevGainFt": {
                "type": "number",
                "description": "Net elevation change across this split, feet. Negative for net downhill; contextualizes a slow or fast split."
              }
            }
          }
        },
        "startLocal": {
          "type": "string",
          "description": "Workout start as full ISO 8601 with local offset, e.g. 2026-08-21T17:15:26-07:00. Preferred over a bare time: unambiguous across DST and sortable."
        },
        "flags": {
          "type": "array",
          "items": {
            "type": "string"
          },
          "description": "Observations the pulling session wants to hand forward \u2014 e.g. 'HR 153 avg on a run programmed as easy', 'no workout recorded for the planned Thu sharpener'. Observations only; leave the coaching call to the consumer."
        },
        "planMatch": {
          "type": "string",
          "description": "Which planned session this appears to be, or a note that it matches none. The consumer reconciles against PLAN in index.html, so this is a hint, not authority."
        },
        "weather": {
          "type": "object",
          "description": "Conditions during the workout. Recorded to CONTEXTUALIZE pace, never to correct it \u2014 see SKILL.md. Apple Watch stores weather metadata on outdoor workouts (HKMetadataKeyWeatherTemperature / HKMetadataKeyWeatherHumidity), so try reading it from the workout before asking Kai. Omit any field HealthKit does not supply.",
          "additionalProperties": false,
          "properties": {
            "tempF": {
              "type": "number",
              "description": "Dry-bulb air temperature, \u00b0F."
            },
            "humidityPct": {
              "type": "integer",
              "minimum": 0,
              "maximum": 100
            },
            "feelsLikeF": {
              "type": "number",
              "description": "Heat index if available. Closer to what the body experiences than dry-bulb, but still ignores solar load."
            },
            "windMph": {
              "type": "number",
              "minimum": 0
            },
            "conditions": {
              "type": "string",
              "description": "Free text for what a thermometer misses and what actually drives heat strain: sun vs overcast, wind direction relative to the route, whether it changed partway. e.g. 'breeze outbound, still air and direct sun on the return'.",
              "examples": [
                "overcast, light headwind outbound",
                "direct sun, no wind after the turnaround"
              ]
            }
          }
        }
      },
      "if": {
        "properties": {
          "kind": {
            "const": "Running"
          }
        },
        "required": [
          "kind"
        ]
      },
      "then": {
        "required": [
          "dist"
        ]
      }
    }
  }
}
